{
  "$schema": "https://json-schema.org/draft/2020-12/schema",
  "$id": "https://github.com/joaobispo2077/avo/providers/avo.provider.schema.json",
  "title": "AVO Provider Manifest",
  "description": "Manifest for an AVO provider workspace (providers/<name>/avo.provider.json). A provider is a publishing destination/identity (YouTube channel, TikTok account, Instagram profile, ...). Provider identity, design, logo and brand live in-repo; ALL media stays EXTERNAL — the manifest stores paths only, never media.",
  "type": "object",
  "additionalProperties": false,
  "required": [
    "name",
    "kind",
    "media"
  ],
  "properties": {
    "$schema": {
      "type": "string",
      "description": "Optional path/URL to this schema for editor validation."
    },
    "name": {
      "type": "string",
      "description": "Provider slug. Lowercase kebab-case; must match the providers/<name>/ directory name.",
      "pattern": "^[a-z0-9][a-z0-9-]*$"
    },
    "displayName": {
      "type": "string",
      "description": "Human-friendly provider name (e.g. 'Bishop')."
    },
    "kind": {
      "type": "string",
      "description": "Publishing destination type.",
      "enum": [
        "youtube",
        "tiktok",
        "instagram",
        "x",
        "podcast",
        "shorts",
        "generic"
      ]
    },
    "description": {
      "type": "string",
      "description": "Short description of the channel/account and its content."
    },
    "scope": {
      "type": "string",
      "description": "What this provider is scoped to within a brand or channel (e.g. '16:9 long-form tutorials', '9:16 Shorts clips'). Defines ai-memory learning boundaries and format expectations."
    },
    "platformUrl": {
      "type": "string",
      "description": "Optional canonical URL for the channel or account (YouTube, TikTok, etc.)."
    },
    "media": {
      "type": "object",
      "description": "EXTERNAL media roots. These are filesystem paths ONLY — no media is ever committed. Paths are gitignored at their source location.",
      "additionalProperties": false,
      "required": [
        "rawRoot"
      ],
      "properties": {
        "rawRoot": {
          "type": "string",
          "description": "External folder that holds this provider's raw footage projects. Absolute path (may be OS-specific). Never inside this repo."
        },
        "editRoot": {
          "type": "string",
          "description": "Optional external folder for edit/working output. Defaults to <rawRoot>/edit when omitted."
        }
      }
    },
    "assets": {
      "type": "object",
      "description": "Optional default asset locations for this provider. sfx/music/inserts/graphics are EXTERNAL paths. logos MAY reference the in-repo providers/<name>/logo directory.",
      "additionalProperties": false,
      "properties": {
        "sfx": {
          "type": "string",
          "description": "External path to sound-effects library."
        },
        "music": {
          "type": "string",
          "description": "External path to music library."
        },
        "inserts": {
          "type": "string",
          "description": "External path to insert/b-roll clips."
        },
        "graphics": {
          "type": "string",
          "description": "External path to graphics/overlays."
        },
        "logos": {
          "type": "string",
          "description": "Logo location. Usually the in-repo path 'providers/<name>/logo'."
        }
      }
    },
    "transcription": {
      "type": "object",
      "description": "Provider default transcription settings. Overrides avo.config.json transcription.language for this provider.",
      "additionalProperties": false,
      "properties": {
        "language": {
          "type": "string",
          "description": "faster-whisper language code (e.g. 'pt', 'en', 'es'). Chosen at setup; not fixed."
        },
        "model": {
          "type": "string",
          "description": "Optional preferred Whisper model size (e.g. 'small', 'large-v3')."
        }
      }
    },
    "models": {
      "type": "object",
      "description": "Optional provider model pins (catalog id string or source object).",
      "additionalProperties": false,
      "properties": {
        "transcribe": { "$ref": "https://github.com/joaobispo2077/avo/avo.model-source.schema.json#/$defs/modelPin" },
        "understand": { "$ref": "https://github.com/joaobispo2077/avo/avo.model-source.schema.json#/$defs/modelPin" },
        "plan": { "$ref": "https://github.com/joaobispo2077/avo/avo.model-source.schema.json#/$defs/modelPin" },
        "transcribe_paid": { "$ref": "https://github.com/joaobispo2077/avo/avo.model-source.schema.json#/$defs/modelPin" }
      }
    },
    "restoration_default_pct": {
      "type": "integer",
      "minimum": 0,
      "maximum": 100,
      "description": "Default noise-reduction strength (0-100) for speech-led content. EDL overrides win."
    },
    "loudness": {
      "type": "object",
      "description": "Provider default loudness intent and channel reference targets.",
      "additionalProperties": false,
      "properties": {
        "default_intent": {
          "type": "string",
          "enum": [
            "platform_fit",
            "channel_standard",
            "creative"
          ],
          "description": "Default loudness resolution intent when project/EDL do not override."
        },
        "channel_standard": {
          "type": "object",
          "description": "Channel-owned integrated loudness, true peak, and LRA reference.",
          "additionalProperties": false,
          "properties": {
            "integrated_lufs": {
              "type": "number",
              "description": "Target integrated loudness (LUFS/LKFS)."
            },
            "true_peak_dbtp": {
              "type": "number",
              "description": "True-peak ceiling (dBTP)."
            },
            "lra_lu": {
              "type": "number",
              "description": "Loudness range target (LU)."
            },
            "note": {
              "type": "string",
              "description": "Human note — not an official platform requirement."
            }
          }
        }
      }
    },
    "brand": {
      "type": "object",
      "description": "Pointers to this provider's in-repo brand material.",
      "additionalProperties": false,
      "properties": {
        "design": {
          "type": "string",
          "description": "Path to the provider DESIGN.md (relative to repo root)."
        },
        "palette": {
          "type": "string",
          "description": "Path to a palette.json under brand/ (relative to repo root)."
        }
      }
    },
    "routingOverrides": {
      "type": "object",
      "description": "Per-provider overrides that patch the shared avo.config.json routing (jobs, confidence, transcription). Same shape as avo.config.json; only the keys to override need to be present.",
      "additionalProperties": true,
      "properties": {
        "motion": {"$ref": "https://avo.local/avo.motion.schema.json#/$defs/config"},
        "watch": {
          "type": "object",
          "additionalProperties": false,
          "properties": {
            "whisperModel": { "type": "string", "minLength": 1 },
            "device": { "type": "string", "pattern": "^(auto|cpu|cuda(:[0-9]+)?)$" },
            "maxFrames": { "type": "integer", "minimum": 1, "maximum": 64 },
            "repairMaxFrames": { "type": "integer", "minimum": 1, "maximum": 64 },
            "analysisAttempts": { "type": "integer", "minimum": 1, "maximum": 3 },
            "toolAttempts": { "type": "integer", "minimum": 1, "maximum": 3 },
            "workingDirectory": { "type": ["string", "null"] },
            "format": { "type": ["string", "null"] },
            "language": { "type": ["string", "null"] },
            "acceptanceCriteria": { "type": "array", "items": { "type": "string", "minLength": 1 } },
            "riskNotes": { "type": "array", "items": { "type": "string", "minLength": 1 } }
          }
        }
      }
    },
    "animationLibrary": {
      "type": "string",
      "description": "Optional provider-relative path to the explicitly approved sanitized animation catalog, normally animations/animation.json. Runtime video timing and media never belong here."
    }
  }
}
